{
  "schema_version": "1.0",
  "uncertainty_id": "30000000-0000-4000-8000-000000000001",
  "estimate_id": "10000000-0000-4000-8000-000000000001",
  "method": {
    "method_id": "paired_bootstrap",
    "method_version": "1.0",
    "parameters_sha256": "44136fa355b3678a1146ad16f7e8649e94fb4fc21fe77e8310c060f61caaff8a"
  },
  "confidence_level": 0.95,
  "sample_count": 3,
  "result": {
    "kind": "interval",
    "lower_bound": 0.12,
    "upper_bound": 0.30,
    "unit": "reward_unit_id",
    "precision": {
      "representation": "finite_binary64",
      "significant_bits": 53,
      "absolute_tolerance": 0.0,
      "relative_tolerance": 0.0
    }
  },
  "inputs": [
    {
      "evidence_id": "seed-pair-schedule-0001",
      "sha256": "bef55103e4f26e661ead6fdc6133c512e9e6230d27dc3285f7d990d8bb794110",
      "role": "paired seed estimates"
    }
  ]
}
